{
  "schema_version": "1.0",
  "framework": "CCMv4",
  "framework_version": "4.0",
  "description": "Per-domain, per-objective mapping guidance for CSA CCMv4. Gives the framework-mapping phase a focused, per-domain context: what each objective actually requires (intent), whether it is mappable for a platform/infrastructure service, and which mechanism classes may or must never satisfy it. allow_mechanisms / deny_mechanisms reference mechanism_classes ids. Consumed by map-framework-mapping (fan-out), validate_domain_applicability.py, and validate_domain_mapping_accuracy.py.",
  "mechanism_classes": {
    "transit_encryption": {
      "description": "Encryption-in-transit / TLS controls (e.g. enforce or detect TLS on a data channel).",
      "match_keywords": [
        "tls",
        "transit",
        "securetransport",
        "in transit",
        "in-transit",
        "encryption in transit"
      ],
      "match_mechanisms": []
    },
    "at_rest_encryption": {
      "description": "Encryption-at-rest controls using a KMS/customer-managed key.",
      "match_keywords": [
        "at rest",
        "at-rest",
        "kms",
        "cmk",
        "customer-managed key",
        "customer managed key",
        "encryption at rest"
      ],
      "match_mechanisms": [
        "KMS Key Policy"
      ]
    },
    "key_lifecycle": {
      "description": "Cryptographic key lifecycle controls (generation, rotation, revocation, destruction, inventory).",
      "match_keywords": [
        "key generation",
        "key rotation",
        "key revocation",
        "key destruction",
        "key lifecycle",
        "key inventory",
        "key activation"
      ],
      "match_mechanisms": []
    },
    "access_control": {
      "description": "Identity/authorization controls: IAM identity policy, principal scoping, resource-based policy, sharing, least-privilege.",
      "match_keywords": [
        "access control",
        "least privilege",
        "least-privilege",
        "principal",
        "authorization",
        "resource policy",
        "resource-based policy",
        "sharing",
        "public access",
        "permission boundary",
        "trust policy",
        "iam"
      ],
      "match_mechanisms": [
        "SCP",
        "IAM Permission Boundary",
        "IAM Trust Policy",
        "Resource Policy",
        "VPC Endpoint Policy",
        "RCP"
      ]
    },
    "network_isolation": {
      "description": "Network-isolation controls: VPC, subnet, security group, segmentation, private endpoint.",
      "match_keywords": [
        "network",
        "vpc",
        "subnet",
        "security group",
        "isolation",
        "private endpoint",
        "segmentation",
        "firewall"
      ],
      "match_mechanisms": []
    },
    "resilience": {
      "description": "Availability / resilience controls: multi-AZ placement, redundancy, failover, recovery.",
      "match_keywords": [
        "availability",
        "multi-az",
        "multi az",
        "high availability",
        "resilience",
        "redundancy",
        "failover",
        "recovery"
      ],
      "match_mechanisms": []
    },
    "access_event_logging": {
      "description": "Controls that LOG access / invocation / activity events (who accessed what), e.g. CloudTrail data/management events.",
      "match_keywords": [
        "access log",
        "activity log",
        "invocation log",
        "cloudtrail",
        "audit log",
        "data event",
        "management event",
        "who accessed",
        "accountability log"
      ],
      "match_mechanisms": [
        "CloudTrail"
      ]
    },
    "misconfig_detection": {
      "description": "Detective controls that flag resource MISCONFIGURATION / posture / drift (not access logging).",
      "match_keywords": [
        "drift",
        "misconfiguration",
        "baseline deviation",
        "posture",
        "non-compliant",
        "noncompliant"
      ],
      "match_mechanisms": [
        "AWS Config Rule"
      ]
    },
    "tagging_classification": {
      "description": "Tag-based controls that classify or label a resource (not the sensitivity of data inside it).",
      "match_keywords": [
        "tag policy",
        "tagging",
        "resource tag",
        "requesttag",
        "tagkeys",
        "tag key"
      ],
      "match_mechanisms": [
        "Tag Policy"
      ]
    },
    "change_control": {
      "description": "Change-management / configuration-baseline controls.",
      "match_keywords": [
        "change management",
        "baseline",
        "configuration management",
        "unauthorized change",
        "change restoration"
      ],
      "match_mechanisms": []
    },
    "vulnerability_management": {
      "description": "Vulnerability scanning, patching, malware, CVE, Inspector pairing.",
      "match_keywords": [
        "vulnerability",
        "patch",
        "scan",
        "cve",
        "inspector",
        "malware"
      ],
      "match_mechanisms": []
    }
  },
  "domains": [
    {
      "domain_id": "A&A",
      "domain_name": "Audit & Assurance",
      "intent": "Governs the organization's audit and assurance program \u2014 establishing, running, and remediating internal/external audits. Predominantly organizational process objectives.",
      "objectives": [
        {
          "objective_id": "A&A-01",
          "title": "Audit and Assurance Policy and Procedures",
          "intent": "Requires a documented, maintained audit and assurance policy \u2014 an organizational governance artifact.",
          "mappable": "default_na",
          "allow_mechanisms": [],
          "deny_mechanisms": [],
          "na_reason": "Organizational governance/process objective; no platform or infrastructure configuration control implements it.",
          "override_requires": [
            "applicability_justification",
            "reference_url"
          ]
        },
        {
          "objective_id": "A&A-02",
          "title": "Independent Assessments",
          "intent": "Requires independent third-party assessments \u2014 an organizational audit activity.",
          "mappable": "default_na",
          "allow_mechanisms": [],
          "deny_mechanisms": [
            "access_event_logging",
            "misconfig_detection"
          ],
          "na_reason": "Organizational governance/process objective; no platform or infrastructure configuration control implements it.",
          "override_requires": [
            "applicability_justification",
            "reference_url"
          ]
        },
        {
          "objective_id": "A&A-03",
          "title": "Risk Based Planning Assessment",
          "intent": "Requires risk-based audit planning \u2014 an organizational process.",
          "mappable": "default_na",
          "allow_mechanisms": [],
          "deny_mechanisms": [],
          "na_reason": "Organizational governance/process objective; no platform or infrastructure configuration control implements it.",
          "override_requires": [
            "applicability_justification",
            "reference_url"
          ]
        },
        {
          "objective_id": "A&A-04",
          "title": "Requirements Compliance",
          "intent": "Requires verifying compliance with audit requirements; Config rules report posture but do not constitute an audit program.",
          "mappable": "default_na",
          "allow_mechanisms": [],
          "deny_mechanisms": [
            "misconfig_detection",
            "access_event_logging"
          ],
          "na_reason": "Organizational governance/process objective; no platform or infrastructure configuration control implements it.",
          "override_requires": [
            "applicability_justification",
            "reference_url"
          ]
        },
        {
          "objective_id": "A&A-05",
          "title": "Audit Management Process",
          "intent": "Requires managing the audit lifecycle \u2014 an organizational process.",
          "mappable": "default_na",
          "allow_mechanisms": [],
          "deny_mechanisms": [],
          "na_reason": "Organizational governance/process objective; no platform or infrastructure configuration control implements it.",
          "override_requires": [
            "applicability_justification",
            "reference_url"
          ]
        },
        {
          "objective_id": "A&A-06",
          "title": "Remediation",
          "intent": "Requires tracking remediation of audit findings \u2014 an organizational process.",
          "mappable": "default_na",
          "allow_mechanisms": [],
          "deny_mechanisms": [
            "misconfig_detection"
          ],
          "na_reason": "Organizational governance/process objective; no platform or infrastructure configuration control implements it.",
          "override_requires": [
            "applicability_justification",
            "reference_url"
          ]
        }
      ]
    },
    {
      "domain_id": "AIS",
      "domain_name": "Application & Interface Security",
      "intent": "Governs the security of application code and the interfaces it exposes. Code/design/testing objectives concern the workload's own source and cannot be satisfied by platform/infra-config mechanisms.",
      "objectives": [
        {
          "objective_id": "AIS-01",
          "title": "Application and Interface Security Policy and Procedures",
          "intent": "Requires an application/interface security policy \u2014 organizational governance.",
          "mappable": "default_na",
          "allow_mechanisms": [],
          "deny_mechanisms": [],
          "na_reason": "Organizational governance/process objective; no platform or infrastructure configuration control implements it.",
          "override_requires": [
            "applicability_justification",
            "reference_url"
          ]
        },
        {